{"$schema":"https://json-schema.org/draft/2020-12/schema","type":"object","required":["job_id","facts","assumptions","missing_information","risk_flags","recommended_outputs"],"properties":{"job_id":{"type":"string"},"facts":{"type":"array","items":{"type":"string"}},"assumptions":{"type":"array","items":{"type":"string"}},"missing_information":{"type":"array","items":{"type":"string"}},"risk_flags":{"type":"array","items":{"type":"string"}},"recommended_outputs":{"type":"array","items":{"type":"string"}}}}
