{"job_id":"00000000-0000-0000-0000-000000000001","facts":["Campaign length is 2 weeks"],"assumptions":["Primary audience is existing subscribers"],"missing_information":["Offer pricing"],"risk_flags":["Health claims require approval"],"recommended_outputs":["campaign_plan","social_posts","email_copy"]}
